{"candidate_id":"CAND-NO-LLM-REPRO","pairing_revision":"negative-r1","runtime":{"name":"expected-json-printer","version":"1","path":"poc_llm/tests/gate1/no_llm_printer.py","sha256":"ab4305a64b6b202e759c4f4c4478647e0f7910d1fd2ad68ab4b224b1a52d3313"},"model":{"name":"test-only-artifact","version":"1","path":"poc_llm/tests/gate1/fake_model.artifact.txt","sha256":"8bfee74c9e67b53729378823e3cf623f3532d8fbb178f0a7e73467bda23872e3"},"config":{"name":"self-test-config","version":"1","path":"poc_llm/tests/gate1/fake_config.json","sha256":"4dc00c2bdda06da54bfbe1078d425173d4febd7b097d6c2afec96e7d1b8a2d4c"},"quantization":"test-only","license":"test-only","offline":true,"aarch64_compatible":true,"commands":{"ubuntu-x86_64":{"argv":["python3","poc_llm/tests/gate1/no_llm_printer.py","--catalog","poc_llm/fixtures/gate1/catalog.json","--validator","poc_llm/harness/gate1_validator.py"],"sha256":"a19361943566289ea38ffe416ab0c28e976beca1a41eec1df6b9113cd8aa6476"},"ubuntu-aarch64":{"argv":["python3","poc_llm/tests/gate1/no_llm_printer.py","--catalog","poc_llm/fixtures/gate1/catalog.json","--validator","poc_llm/harness/gate1_validator.py"],"sha256":"a19361943566289ea38ffe416ab0c28e976beca1a41eec1df6b9113cd8aa6476"}}}
