{"candidate_id":"CAND-PROTOCOL-SELFTEST","pairing_revision":"test-only-r1","runtime":{"name":"protocol-test-double","version":"1","path":"poc_llm/tests/gate1/fake_candidate.py","sha256":"340518d6f22bcf094a6fb3780800403b87f132b4d084350fbf1cc3b054260ef0"},"model":{"name":"test-only-artifact","version":"1","path":"poc_llm/tests/gate1/fake_model.artifact.txt","sha256":"8bfee74c9e67b53729378823e3cf623f3532d8fbb178f0a7e73467bda23872e3"},"config":{"name":"self-test-config","version":"1","path":"poc_llm/tests/gate1/fake_config.json","sha256":"4dc00c2bdda06da54bfbe1078d425173d4febd7b097d6c2afec96e7d1b8a2d4c"},"quantization":"test-only","license":"test-only","offline":true,"aarch64_compatible":true,"commands":{"ubuntu-x86_64":{"argv":["python3","poc_llm/tests/gate1/fake_candidate.py","--catalog","poc_llm/fixtures/gate1/catalog.json","--candidate-id","CAND-PROTOCOL-SELFTEST","--runtime-sha","340518d6f22bcf094a6fb3780800403b87f132b4d084350fbf1cc3b054260ef0","--model-sha","8bfee74c9e67b53729378823e3cf623f3532d8fbb178f0a7e73467bda23872e3","--config-sha","4dc00c2bdda06da54bfbe1078d425173d4febd7b097d6c2afec96e7d1b8a2d4c"],"sha256":"4d3a9643dbb00facd11fbd5124585b9ae103a91c0cd646b0f7f2c7028af331c5"},"ubuntu-aarch64":{"argv":["python3","poc_llm/tests/gate1/fake_candidate.py","--catalog","poc_llm/fixtures/gate1/catalog.json","--candidate-id","CAND-PROTOCOL-SELFTEST","--runtime-sha","340518d6f22bcf094a6fb3780800403b87f132b4d084350fbf1cc3b054260ef0","--model-sha","8bfee74c9e67b53729378823e3cf623f3532d8fbb178f0a7e73467bda23872e3","--config-sha","4dc00c2bdda06da54bfbe1078d425173d4febd7b097d6c2afec96e7d1b8a2d4c"],"sha256":"4d3a9643dbb00facd11fbd5124585b9ae103a91c0cd646b0f7f2c7028af331c5"}}}
